{
  "schema_version": "career.resume_analysis.v1",
  "policy_version": "resume_analysis_v1",
  "reference_policy_version": "deterministic_v2",
  "normalization_policy_version": "resume_normalization_v1",
  "core_version": "0.1.1",
  "document_id": "synthetic-phase3-messy-v1",
  "scoring_weights": {
    "format_ats": 20,
    "content_strength": 25,
    "experience_impact": 20,
    "skills_coverage": 15,
    "presentation": 10,
    "completeness": 10
  },
  "overall_score": 62,
  "category_scores": {
    "format_ats": 58,
    "content_strength": 75,
    "experience_impact": 50,
    "skills_coverage": 50,
    "presentation": 67,
    "completeness": 70
  },
  "summary": "Deterministic analysis completed with an overall score of 62. Strongest category: content_strength. Weakest category: experience_impact.",
  "checks": [
    {
      "check_id": "contact_email_present",
      "category": "completeness",
      "raw_score": 100,
      "score": 100,
      "score_adjusted": false,
      "passed": true,
      "outcome": "passed",
      "detection_status": null,
      "explanation": "Email detected.",
      "evidence": [
        {
          "evidence_id": "resume.analysis.contact_email_present.normalized_field",
          "kind": "normalized_field",
          "source": {
            "start_line": 2,
            "end_line": 2,
            "excerpt": "morgan.lee@example.com",
            "transformation": "verbatim"
          },
          "value": "email_present=true"
        }
      ]
    },
    {
      "check_id": "contact_name_present",
      "category": "completeness",
      "raw_score": 100,
      "score": 100,
      "score_adjusted": false,
      "passed": true,
      "outcome": "passed",
      "detection_status": null,
      "explanation": "Candidate name detected.",
      "evidence": [
        {
          "evidence_id": "resume.analysis.contact_name_present.normalized_field",
          "kind": "normalized_field",
          "source": {
            "start_line": 1,
            "end_line": 1,
            "excerpt": "Morgan Lee",
            "transformation": "verbatim"
          },
          "value": "name_present=true"
        }
      ]
    },
    {
      "check_id": "contact_phone_or_link_present",
      "category": "completeness",
      "raw_score": 0,
      "score": 0,
      "score_adjusted": false,
      "passed": false,
      "outcome": "failed",
      "detection_status": null,
      "explanation": "No phone number or profile link detected.",
      "evidence": [
        {
          "evidence_id": "resume.analysis.contact_phone_or_link_present.normalized_field",
          "kind": "normalized_field",
          "source": null,
          "value": "phone_present=false; link_count=0"
        }
      ]
    },
    {
      "check_id": "summary_present",
      "category": "content_strength",
      "raw_score": 0,
      "score": 50,
      "score_adjusted": true,
      "passed": false,
      "outcome": "inconclusive",
      "detection_status": "not_detected",
      "explanation": "Summary was not detected; limited parsing confidence makes this check inconclusive.",
      "evidence": [
        {
          "evidence_id": "resume.analysis.summary_present.normalized_field",
          "kind": "normalized_field",
          "source": null,
          "value": "summary_present=false"
        },
        {
          "evidence_id": "resume.analysis.summary_present.field_status",
          "kind": "field_status",
          "source": null,
          "value": "field=summary; status=not_detected"
        }
      ]
    },
    {
      "check_id": "experience_section_present",
      "category": "completeness",
      "raw_score": 0,
      "score": 50,
      "score_adjusted": true,
      "passed": false,
      "outcome": "inconclusive",
      "detection_status": "not_detected",
      "explanation": "Experience was not detected; limited parsing confidence makes this check inconclusive.",
      "evidence": [
        {
          "evidence_id": "resume.analysis.experience_section_present.normalized_field",
          "kind": "normalized_field",
          "source": null,
          "value": "experience_entry_count=0"
        },
        {
          "evidence_id": "resume.analysis.experience_section_present.field_status",
          "kind": "field_status",
          "source": null,
          "value": "field=experience; status=not_detected"
        }
      ]
    },
    {
      "check_id": "education_section_present",
      "category": "completeness",
      "raw_score": 100,
      "score": 100,
      "score_adjusted": false,
      "passed": true,
      "outcome": "passed",
      "detection_status": "detected",
      "explanation": "Education section detected.",
      "evidence": [
        {
          "evidence_id": "resume.analysis.education_section_present.normalized_field",
          "kind": "normalized_field",
          "source": {
            "start_line": 8,
            "end_line": 10,
            "excerpt": "Bachelor of Science in Computer Science\nExample University\n2016 - 2020",
            "transformation": "conservative_fallback"
          },
          "value": "education_entry_count=1"
        },
        {
          "evidence_id": "resume.analysis.education_section_present.field_status",
          "kind": "field_status",
          "source": null,
          "value": "field=education; status=detected"
        }
      ]
    },
    {
      "check_id": "skills_section_present",
      "category": "skills_coverage",
      "raw_score": 0,
      "score": 50,
      "score_adjusted": true,
      "passed": false,
      "outcome": "inconclusive",
      "detection_status": "not_detected",
      "explanation": "Skills was not detected; limited parsing confidence makes this check inconclusive.",
      "evidence": [
        {
          "evidence_id": "resume.analysis.skills_section_present.normalized_field",
          "kind": "normalized_field",
          "source": null,
          "value": "skill_count=0"
        },
        {
          "evidence_id": "resume.analysis.skills_section_present.field_status",
          "kind": "field_status",
          "source": null,
          "value": "field=skills; status=not_detected"
        }
      ]
    },
    {
      "check_id": "experience_bullets_present",
      "category": "experience_impact",
      "raw_score": 0,
      "score": 50,
      "score_adjusted": true,
      "passed": false,
      "outcome": "inconclusive",
      "detection_status": "not_detected",
      "explanation": "Experience was not detected; limited parsing confidence makes this check inconclusive.",
      "evidence": [
        {
          "evidence_id": "resume.analysis.experience_bullets_present.metric",
          "kind": "derived_metric",
          "source": null,
          "value": "experience_bullet_count=0"
        },
        {
          "evidence_id": "resume.analysis.experience_bullets_present.field_status",
          "kind": "field_status",
          "source": null,
          "value": "field=experience; status=not_detected"
        }
      ]
    },
    {
      "check_id": "experience_bullet_length_quality",
      "category": "experience_impact",
      "raw_score": 0,
      "score": 50,
      "score_adjusted": true,
      "passed": false,
      "outcome": "inconclusive",
      "detection_status": "not_detected",
      "explanation": "Experience was not detected; limited parsing confidence makes this check inconclusive.",
      "evidence": [
        {
          "evidence_id": "resume.analysis.experience_bullet_length_quality.metric",
          "kind": "derived_metric",
          "source": null,
          "value": "reasonably_sized_bullets=0/0"
        },
        {
          "evidence_id": "resume.analysis.experience_bullet_length_quality.field_status",
          "kind": "field_status",
          "source": null,
          "value": "field=experience; status=not_detected"
        }
      ]
    },
    {
      "check_id": "experience_date_ranges_present",
      "category": "presentation",
      "raw_score": 0,
      "score": 50,
      "score_adjusted": true,
      "passed": false,
      "outcome": "inconclusive",
      "detection_status": "not_detected",
      "explanation": "Experience was not detected; limited parsing confidence makes this check inconclusive.",
      "evidence": [
        {
          "evidence_id": "resume.analysis.experience_date_ranges_present.metric",
          "kind": "derived_metric",
          "source": null,
          "value": "entries_with_date_ranges=0/0"
        },
        {
          "evidence_id": "resume.analysis.experience_date_ranges_present.field_status",
          "kind": "field_status",
          "source": null,
          "value": "field=experience; status=not_detected"
        }
      ]
    },
    {
      "check_id": "experience_chronology_consistency",
      "category": "presentation",
      "raw_score": 0,
      "score": 50,
      "score_adjusted": true,
      "passed": false,
      "outcome": "inconclusive",
      "detection_status": "not_detected",
      "explanation": "Experience was not detected; limited parsing confidence makes this check inconclusive.",
      "evidence": [
        {
          "evidence_id": "resume.analysis.experience_chronology_consistency.metric",
          "kind": "derived_metric",
          "source": null,
          "value": "entries_with_reasonable_date_signals=0/0"
        },
        {
          "evidence_id": "resume.analysis.experience_chronology_consistency.field_status",
          "kind": "field_status",
          "source": null,
          "value": "field=experience; status=not_detected"
        }
      ]
    },
    {
      "check_id": "measurable_impact_in_bullets",
      "category": "experience_impact",
      "raw_score": 0,
      "score": 50,
      "score_adjusted": true,
      "passed": false,
      "outcome": "inconclusive",
      "detection_status": "not_detected",